{
  "$schema": "https://json-schema.org/draft/2020-12/schema",
  "title": "Skill Quality Auditor Review Report Format",
  "type": "object",
  "required": [
    "required_title_prefix",
    "required_frontmatter_keys",
    "required_metadata_labels",
    "required_h2_groups",
    "required_h2_order",
    "required_dimension_labels",
    "required_commands"
  ],
  "properties": {
    "required_title_prefix": {
      "type": "string",
      "minLength": 1
    },
    "required_frontmatter_keys": {
      "type": "array",
      "minItems": 0,
      "items": { "type": "string" }
    },
    "recommended_frontmatter_keys": {
      "type": "array",
      "minItems": 0,
      "items": { "type": "string" }
    },
    "required_h2_groups": {
      "type": "array",
      "minItems": 5,
      "items": {
        "type": "array",
        "minItems": 1,
        "items": { "type": "string" }
      }
    },
    "required_h2_order": {
      "type": "array",
      "minItems": 5,
      "items": {
        "type": "array",
        "minItems": 1,
        "items": { "type": "string" }
      }
    },
    "recommended_h2_groups": {
      "type": "array",
      "items": {
        "type": "array",
        "minItems": 1,
        "items": { "type": "string" }
      }
    },
    "required_metadata_labels": {
      "type": "array",
      "minItems": 0,
      "items": { "type": "string" }
    },
    "recommended_metadata_labels": {
      "type": "array",
      "minItems": 0,
      "items": { "type": "string" }
    },
    "required_dimension_labels": {
      "type": "array",
      "minItems": 8,
      "items": { "type": "string" }
    },
    "required_commands": {
      "type": "array",
      "minItems": 0,
      "items": { "type": "string" }
    },
    "recommended_commands": {
      "type": "array",
      "minItems": 0,
      "items": { "type": "string" }
    }
  },
  "additionalProperties": false
}
