{
  "required_title_prefix": "Skill Evaluation Report:",
  "required_frontmatter_keys": ["review_date", "reviewer", "skill_location"],
  "recommended_frontmatter_keys": [],
  "required_metadata_labels": [],
  "recommended_metadata_labels": [],
  "required_h2_groups": [
    ["Executive Summary", "Summary"],
    ["Dimension Scores"],
    ["Critical Issues", "Findings"],
    [
      "Top 3 Recommended Improvements",
      "Top 3 Improvements",
      "Improvements Applied"
    ],
    ["Detailed Dimension Analysis", "Detailed Analysis", "Dimension Analysis"],
    ["Proposed Restructured SKILL.md", "Proposed SKILL.md Changes"]
  ],
  "required_h2_order": [
    ["Executive Summary", "Summary"],
    ["Dimension Scores"],
    ["Critical Issues", "Findings"],
    [
      "Top 3 Recommended Improvements",
      "Top 3 Improvements",
      "Improvements Applied"
    ],
    ["Detailed Dimension Analysis", "Detailed Analysis", "Dimension Analysis"],
    ["Proposed Restructured SKILL.md", "Proposed SKILL.md Changes"]
  ],
  "recommended_h2_groups": [
    ["Conclusion"],
    ["Files Inventory", "Files Audit"],
    ["Verification"],
    ["Audit Execution"],
    ["Score Evolution"],
    ["Grade Scale Reference"]
  ],
  "required_dimension_labels": [
    "D1: Knowledge Delta",
    "D2: Mindset + Procedures",
    "D3: Anti-Pattern Quality",
    "D4: Specification Compliance",
    "D5: Progressive Disclosure",
    "D6: Freedom Calibration",
    "D7: Pattern Recognition",
    "D8: Practical Usability",
    "D9: Eval Validation"
  ],
  "required_commands": [],
  "recommended_commands": [
    "./scripts/evaluate.sh",
    "./scripts/audit-skills.sh",
    "./scripts/detect-duplication.sh"
  ]
}
